{
  "scenario": "versioned-external-dep",
  "schema": "freshdag.scenario/v0.1",
  "description": "The recipe calls attio://company/acme, whose record has a monotonic version token. Unchanged version → valid. Bumped version → stale.",
  "input_observations": [
    {
      "event_id": "018f5b52-4b8b-7a1a-9c2f-000000000030",
      "producer": "freshdag-adapter-claude",
      "producer_version": "0.1.0",
      "session_id": "sess-versioned",
      "ts": "2026-08-15T13:45:14.220000000Z",
      "kind": "tool.invoked",
      "payload": {
        "tool_name": "mcp/attio/get-record",
        "tool_kind": "mcp",
        "tool_input": { "record_id": "acme" },
        "cwd": "/repo"
      }
    },
    {
      "event_id": "018f5b52-4b8b-7a1a-9c2f-000000000031",
      "producer": "freshdag-adapter-claude",
      "producer_version": "0.1.0",
      "session_id": "sess-versioned",
      "ts": "2026-08-15T13:45:15.100000000Z",
      "kind": "tool.completed",
      "payload": {
        "tool_output": { "name": "Acme", "version": 42 },
        "is_error": false,
        "duration_ms": 187
      }
    }
  ],
  "input_probes": {
    "attio://company/acme": {
      "recorded_version": 42,
      "no_change_yields": "match",
      "version_bump_yields": "drift"
    }
  },
  "expected": {
    "dependency_graph": [
      {
        "dependency_key": "attio://company/acme",
        "scheme": "attio",
        "trust_class": "versioned"
      }
    ],
    "certificate_status": { "value": "valid" },
    "invalidation": {
      "before_mutation": "valid",
      "after_mutation": "stale",
      "mutated_dependency_keys": ["attio://company/acme"]
    }
  },
  "notes": [
    "fixture 6 in docs/EVALUATION.md §2"
  ]
}
