{
  "scenario": "volatile-external-dep-probed",
  "schema": "freshdag.scenario/v0.1",
  "description": "The same web.search dependency as volatile-external-dep, with a probe registered and answering match. The certificate MUST be identical: ARCHITECTURE.md \u00a77 decides a volatile edge from its declared TTL, as a positive branch before probe arbitration, so whether an operator happens to have installed a probe for the scheme is not evidence about the world.",
  "input_observations": [
    {
      "event_id": "018f5b52-4b8b-7a1a-9c2f-000000000140",
      "producer": "freshdag-adapter-claude",
      "producer_version": "0.1.0",
      "session_id": "sess-volatile-probed",
      "computation_id": "comp:f08a66ae0eefdb195f3516260b98d481eca4fd40861fcb28eb219545421e6031",
      "ts": "2026-08-15T13:45:13.000000000Z",
      "kind": "computation.started",
      "payload": {
        "recipe_id": "pricing-watch",
        "recipe_hash": "blake3:1cc4c8682b09910b587ecc7df112f5d58734bc729b232bbf23984048aaf8eabc"
      }
    },
    {
      "event_id": "018f5b52-4b8b-7a1a-9c2f-000000000141",
      "producer": "freshdag-adapter-claude",
      "producer_version": "0.1.0",
      "session_id": "sess-volatile-probed",
      "computation_id": "comp:f08a66ae0eefdb195f3516260b98d481eca4fd40861fcb28eb219545421e6031",
      "ts": "2026-08-15T13:45:14.220000000Z",
      "kind": "tool.invoked",
      "payload": {
        "tool_name": "web.search",
        "tool_kind": "builtin",
        "tool_input": {
          "q": "acme pricing changes 2026"
        },
        "cwd": "/repo"
      }
    },
    {
      "event_id": "018f5b52-4b8b-7a1a-9c2f-000000000142",
      "producer": "freshdag-probe-web-search",
      "producer_version": "0.1.0",
      "session_id": "sess-volatile-probed",
      "computation_id": "comp:f08a66ae0eefdb195f3516260b98d481eca4fd40861fcb28eb219545421e6031",
      "ts": "2026-08-15T13:45:14.500000000Z",
      "kind": "probe.checked",
      "payload": {
        "scheme": "web.search",
        "key": "q=acme pricing changes 2026",
        "observed_fingerprint": "blake3:47e2ee3be83f06c1c0a43cef2fe5a269bacf79a159e0b42b2a6b6fca3d63659d",
        "trust_class": "volatile",
        "ttl_seconds": 3600,
        "result": "match"
      }
    },
    {
      "event_id": "018f5b52-4b8b-7a1a-9c2f-000000000143",
      "producer": "freshdag-adapter-claude",
      "producer_version": "0.1.0",
      "session_id": "sess-volatile-probed",
      "computation_id": "comp:f08a66ae0eefdb195f3516260b98d481eca4fd40861fcb28eb219545421e6031",
      "ts": "2026-08-15T13:45:15.100000000Z",
      "kind": "tool.completed",
      "payload": {
        "tool_output": {},
        "is_error": false,
        "duration_ms": 800
      }
    },
    {
      "event_id": "018f5b52-4b8b-7a1a-9c2f-000000000144",
      "producer": "freshdag-adapter-claude",
      "producer_version": "0.1.0",
      "session_id": "sess-volatile-probed",
      "computation_id": "comp:f08a66ae0eefdb195f3516260b98d481eca4fd40861fcb28eb219545421e6031",
      "ts": "2026-08-15T13:45:15.200000000Z",
      "kind": "fs.write",
      "payload": {
        "path": "/repo/pricing.md",
        "size": 300,
        "mode": "truncate",
        "hash": "blake3:5bf9ae444a907ae7bc15075dde4924f567188ec7478f83334e39d9dcb41e7fba"
      }
    },
    {
      "event_id": "018f5b52-4b8b-7a1a-9c2f-000000000145",
      "producer": "freshdag-adapter-claude",
      "producer_version": "0.1.0",
      "session_id": "sess-volatile-probed",
      "computation_id": "comp:f08a66ae0eefdb195f3516260b98d481eca4fd40861fcb28eb219545421e6031",
      "ts": "2026-08-15T13:45:15.300000000Z",
      "kind": "artifact.produced",
      "payload": {
        "artifact_id": "blake3:5bf9ae444a907ae7bc15075dde4924f567188ec7478f83334e39d9dcb41e7fba",
        "path": "/repo/pricing.md",
        "content_hash": "blake3:5bf9ae444a907ae7bc15075dde4924f567188ec7478f83334e39d9dcb41e7fba",
        "kind": "text/markdown",
        "size": 300,
        "produced_by": "comp:f08a66ae0eefdb195f3516260b98d481eca4fd40861fcb28eb219545421e6031",
        "comparator": "exact"
      }
    },
    {
      "event_id": "018f5b52-4b8b-7a1a-9c2f-000000000146",
      "producer": "freshdag-adapter-claude",
      "producer_version": "0.1.0",
      "session_id": "sess-volatile-probed",
      "computation_id": "comp:f08a66ae0eefdb195f3516260b98d481eca4fd40861fcb28eb219545421e6031",
      "ts": "2026-08-15T13:45:15.400000000Z",
      "kind": "computation.ended",
      "payload": {
        "status": "ok"
      }
    }
  ],
  "expected": {
    "dependency_graph": [
      {
        "dependency_key": "web.search://q=acme pricing changes 2026",
        "scheme": "web.search",
        "trust_class": "volatile"
      }
    ],
    "certificate_status": {
      "value": "likely-valid",
      "reason_codes": [
        "trust-class-volatile-caps-at-likely-valid"
      ]
    },
    "invalidation": {
      "before_mutation": "likely-valid",
      "after_mutation": "unknown",
      "after_mutation_reason_codes": [
        "ttl-expired"
      ],
      "mutated_dependency_keys": []
    }
  },
  "notes": [
    "sibling of fixture 7 in docs/EVALUATION.md \u00a72, added by the ADR 0009 amendment",
    "after_mutation=unknown is reached the same way as in the unprobed arm: the harness advances its injected clock past ttl_seconds. The scripted probe still answers match, which must not rescue an elapsed TTL.",
    "This is the PROBED arm; volatile-external-dep is the unprobed arm. Their `value` fields are deliberately identical and their `reason_codes` deliberately are NOT. The identical VALUE is the assertion \u2014 ADR 0009 Amendment 2's guarantee that registering a probe cannot by itself move a volatile edge's verdict, only positive drift evidence can. The differing REASON is W9.1's: same verdict, different evidence, and the certificate must say which. Before W9.1 both blocks were identical and the notes said that identity was the assertion; when the reason codes split, the pair silently stopped pinning the verdict guarantee it existed for. `the_probed_and_unprobed_volatile_arms_agree_on_the_verdict` in crates/freshdag-engine/src/tests.rs now pins it directly, because a note is not a test."
  ],
  "input_probes": {
    "web.search://q=acme pricing changes 2026": {
      "trust_class": "volatile",
      "no_change_yields": "match",
      "after_mutation_yields": "match"
    }
  }
}
